{
  "schema_version": "0.1.0",
  "kind": "capture",
  "capture_id": "rule-change-ko-kinship-address-context-provider-authorized-c2-r3-with",
  "captured_at": "2026-07-20",
  "scored": false,
  "pack_evidence": false,
  "clip": {
    "id": "Ni5rBtowdnI",
    "duration_s": 45,
    "lang": "ko",
    "pair": "ko->en",
    "media": null,
    "source": {
      "kind": "youtube",
      "url": "https://www.youtube.com/watch?v=Ni5rBtowdnI",
      "channel": "외대알리",
      "licence": "Creative Commons Attribution license (reuse allowed)",
      "window": {
        "start": "00:00:00",
        "end": "00:00:45"
      },
      "attribution": "\"[한국외대 외대알리] 인터뷰#5 - 와킹댄서 킹키=김기현\" by 외대알리, used under Creative Commons Attribution license (reuse allowed)."
    }
  },
  "reproducible": {
    "deterministic": false,
    "note": "One provider translation call with no retry or output selection. Provider behavior is not deterministic."
  },
  "systems": [
    {
      "id": "1321-openai-audio-translation-rule-change",
      "role": "subject",
      "config": {
        "model": "whisper-1",
        "provider": {
          "id": "openai",
          "operation": "audio_translation",
          "response_format": "verbose_json",
          "temperature": 0,
          "timeout_ms": 120000,
          "max_response_bytes": 1048576
        },
        "reviewed_memory": {
          "rule_content_id": "sha256:365d886cdd82f867d244c538f622b66c3addf4d6a36e42ef543dde57292157a7"
        }
      }
    }
  ],
  "measured": {
    "1321-openai-audio-translation-rule-change": {
      "units_total": 11,
      "units_emitted": 11,
      "units_withheld": 0,
      "coverage": 1,
      "latency": {
        "first_usable_s": null,
        "complete_s": 2.779
      }
    }
  },
  "unscored": {
    "critical_meaning": null,
    "critical_outcomes": null,
    "catastrophic": null,
    "reason": "Provider capture has no semantic authority. Human labels and separate scores are required."
  },
  "units": [
    {
      "t_start": 0,
      "t_end": 4,
      "source": "",
      "outputs": {
        "1321-openai-audio-translation-rule-change": {
          "text": "My name is Kim Ki-hyun, and I'm a dancer.",
          "withheld": null
        }
      },
      "gold": null
    },
    {
      "t_start": 4,
      "t_end": 8,
      "source": "",
      "outputs": {
        "1321-openai-audio-translation-rule-change": {
          "text": "My name is Kim Ki-hyun, and I'm a dancer.",
          "withheld": null
        }
      },
      "gold": null
    },
    {
      "t_start": 8,
      "t_end": 12,
      "source": "",
      "outputs": {
        "1321-openai-audio-translation-rule-change": {
          "text": "My name is Kim Ki-hyun, and I'm a dancer.",
          "withheld": null
        }
      },
      "gold": null
    },
    {
      "t_start": 12,
      "t_end": 16,
      "source": "",
      "outputs": {
        "1321-openai-audio-translation-rule-change": {
          "text": "My name is Kim Ki-hyun, and I'm a dancer.",
          "withheld": null
        }
      },
      "gold": null
    },
    {
      "t_start": 16,
      "t_end": 20,
      "source": "",
      "outputs": {
        "1321-openai-audio-translation-rule-change": {
          "text": "My name is Kim Ki-hyun, and I'm a dancer.",
          "withheld": null
        }
      },
      "gold": null
    },
    {
      "t_start": 20,
      "t_end": 24,
      "source": "",
      "outputs": {
        "1321-openai-audio-translation-rule-change": {
          "text": "My name is Kim Ki-hyun, and I'm a dancer.",
          "withheld": null
        }
      },
      "gold": null
    },
    {
      "t_start": 24,
      "t_end": 28,
      "source": "",
      "outputs": {
        "1321-openai-audio-translation-rule-change": {
          "text": "My name is Kim Ki-hyun, and I'm a dancer.",
          "withheld": null
        }
      },
      "gold": null
    },
    {
      "t_start": 28,
      "t_end": 32,
      "source": "",
      "outputs": {
        "1321-openai-audio-translation-rule-change": {
          "text": "My name is Kim Ki-hyun, and I'm a dancer.",
          "withheld": null
        }
      },
      "gold": null
    },
    {
      "t_start": 32,
      "t_end": 36,
      "source": "",
      "outputs": {
        "1321-openai-audio-translation-rule-change": {
          "text": "My name is Kim Ki-hyun, and I'm a dancer.",
          "withheld": null
        }
      },
      "gold": null
    },
    {
      "t_start": 36,
      "t_end": 40,
      "source": "",
      "outputs": {
        "1321-openai-audio-translation-rule-change": {
          "text": "My name is Kim Ki-hyun, and I'm a dancer.",
          "withheld": null
        }
      },
      "gold": null
    },
    {
      "t_start": 40,
      "t_end": 44,
      "source": "",
      "outputs": {
        "1321-openai-audio-translation-rule-change": {
          "text": "My name is Kim Ki-hyun, and I'm a dancer.",
          "withheld": null
        }
      },
      "gold": null
    }
  ],
  "artifacts": {
    "provider_response": "bench/attempts/rule-change-ko-kinship-address-context-provider-authorized-c2-r3-with/provider-response.json"
  },
  "notes": "Unscored OpenAI audio translation capture. Empty source text records that the endpoint returned English translation only."
}
